[
  {
    "id": "fed-press-all",
    "name": "Federal Reserve — all press releases",
    "url": "https://www.federalreserve.gov/feeds/press_all.xml",
    "type": "rss",
    "cadence": "0 */6 * * *",
    "vertical": "fintech"
  },
  {
    "id": "fed-press-monetary",
    "name": "Federal Reserve — monetary policy press releases",
    "url": "https://www.federalreserve.gov/feeds/press_monetary.xml",
    "type": "rss",
    "cadence": "0 */6 * * *",
    "vertical": "fintech"
  },
  {
    "id": "fed-press-bcreg",
    "name": "Federal Reserve — banking supervision and regulation press releases",
    "url": "https://www.federalreserve.gov/feeds/press_bcreg.xml",
    "type": "rss",
    "cadence": "0 */6 * * *",
    "vertical": "fintech"
  },
  {
    "id": "fed-press-enforcement",
    "name": "Federal Reserve — enforcement actions",
    "url": "https://www.federalreserve.gov/feeds/press_enforcement.xml",
    "type": "rss",
    "cadence": "0 */12 * * *",
    "vertical": "fintech"
  },
  {
    "id": "fed-press-orders",
    "name": "Federal Reserve — orders on banking applications",
    "url": "https://www.federalreserve.gov/feeds/press_orders.xml",
    "type": "rss",
    "cadence": "0 */12 * * *",
    "vertical": "fintech"
  },
  {
    "id": "fed-speeches",
    "name": "Federal Reserve — speeches",
    "url": "https://www.federalreserve.gov/feeds/speeches.xml",
    "type": "rss",
    "cadence": "0 */12 * * *",
    "vertical": "fintech"
  },
  {
    "id": "fed-testimony",
    "name": "Federal Reserve — congressional testimony",
    "url": "https://www.federalreserve.gov/feeds/testimony.xml",
    "type": "rss",
    "cadence": "0 8 * * *",
    "vertical": "fintech"
  },
  {
    "id": "fed-data-releases",
    "name": "Federal Reserve — H.4.1, H.6, G.19 statistical releases",
    "url": "https://www.federalreserve.gov/feeds/datadownload.xml",
    "type": "http",
    "cadence": "0 */6 * * *",
    "vertical": "fintech"
  },
  {
    "id": "fed-foia",
    "name": "Federal Reserve — FOIA reading room updates",
    "url": "https://www.federalreserve.gov/foia/readingrooms.htm",
    "type": "http",
    "cadence": "0 12 * * *",
    "vertical": "fintech"
  },
  {
    "id": "fed-consumer-affairs",
    "name": "Federal Reserve — consumer-affairs press releases",
    "url": "https://www.federalreserve.gov/feeds/press_other.xml",
    "type": "rss",
    "cadence": "0 */12 * * *",
    "vertical": "fintech"
  },
  {
    "id": "occ-news",
    "name": "OCC — news releases",
    "url": "https://www.occ.treas.gov/rss/occ_news.xml",
    "type": "rss",
    "cadence": "0 */6 * * *",
    "vertical": "fintech"
  },
  {
    "id": "occ-bulletins",
    "name": "OCC — bulletins",
    "url": "https://www.occ.treas.gov/rss/occ_bulletins.xml",
    "type": "rss",
    "cadence": "0 */6 * * *",
    "vertical": "fintech"
  },
  {
    "id": "occ-enforcement",
    "name": "OCC — enforcement actions search",
    "url": "https://apps.occ.gov/EnforcementActions/",
    "type": "http",
    "cadence": "0 */12 * * *",
    "vertical": "fintech"
  },
  {
    "id": "occ-cra",
    "name": "OCC — Community Reinvestment Act evaluations",
    "url": "https://www.occ.treas.gov/topics/consumers-and-communities/cra/cra-evaluations.html",
    "type": "http",
    "cadence": "0 8 * * *",
    "vertical": "fintech"
  },
  {
    "id": "cfpb-newsroom",
    "name": "CFPB — newsroom",
    "url": "https://www.consumerfinance.gov/about-us/newsroom/feed/",
    "type": "rss",
    "cadence": "0 */6 * * *",
    "vertical": "fintech"
  },
  {
    "id": "cfpb-enforcement",
    "name": "CFPB — enforcement actions",
    "url": "https://www.consumerfinance.gov/enforcement/actions/",
    "type": "http",
    "cadence": "0 */12 * * *",
    "vertical": "fintech"
  },
  {
    "id": "cfpb-final-rules",
    "name": "CFPB — final rules",
    "url": "https://www.consumerfinance.gov/rules-policy/final-rules/",
    "type": "http",
    "cadence": "0 8 * * *",
    "vertical": "fintech"
  },
  {
    "id": "cfpb-blog",
    "name": "CFPB — blog",
    "url": "https://www.consumerfinance.gov/about-us/blog/feed/",
    "type": "rss",
    "cadence": "0 */6 * * *",
    "vertical": "fintech"
  },
  {
    "id": "cfpb-research-reports",
    "name": "CFPB — research reports",
    "url": "https://www.consumerfinance.gov/data-research/research-reports/",
    "type": "http",
    "cadence": "0 8 * * *",
    "vertical": "fintech"
  },
  {
    "id": "cfpb-consumer-complaints",
    "name": "CFPB — consumer complaint database",
    "url": "https://www.consumerfinance.gov/data-research/consumer-complaints/search/api/v1/",
    "type": "http",
    "cadence": "0 */6 * * *",
    "vertical": "fintech"
  },
  {
    "id": "fdic-press-releases",
    "name": "FDIC — press releases",
    "url": "https://www.fdic.gov/news/press-releases/",
    "type": "http",
    "cadence": "0 */6 * * *",
    "vertical": "fintech"
  },
  {
    "id": "fdic-financial-institution-letters",
    "name": "FDIC — Financial Institution Letters",
    "url": "https://www.fdic.gov/news/financial-institution-letters/",
    "type": "http",
    "cadence": "0 */12 * * *",
    "vertical": "fintech"
  },
  {
    "id": "fdic-enforcement-decisions",
    "name": "FDIC — enforcement decisions and orders",
    "url": "https://orders.fdic.gov/s/searchform",
    "type": "http",
    "cadence": "0 */12 * * *",
    "vertical": "fintech"
  },
  {
    "id": "fdic-failed-banks",
    "name": "FDIC — failed bank list",
    "url": "https://www.fdic.gov/resources/resolutions/bank-failures/failed-bank-list/",
    "type": "http",
    "cadence": "0 8 * * *",
    "vertical": "fintech"
  },
  {
    "id": "sec-edgar-10k",
    "name": "SEC EDGAR — 10-K filings (latest)",
    "url": "https://www.sec.gov/cgi-bin/browse-edgar?action=getcompany&type=10-K&dateb=&owner=include&count=40&output=atom",
    "type": "atom",
    "cadence": "0 * * * *",
    "vertical": "fintech"
  },
  {
    "id": "sec-edgar-10q",
    "name": "SEC EDGAR — 10-Q filings (latest)",
    "url": "https://www.sec.gov/cgi-bin/browse-edgar?action=getcompany&type=10-Q&dateb=&owner=include&count=40&output=atom",
    "type": "atom",
    "cadence": "0 * * * *",
    "vertical": "fintech"
  },
  {
    "id": "sec-edgar-8k",
    "name": "SEC EDGAR — 8-K filings (latest)",
    "url": "https://www.sec.gov/cgi-bin/browse-edgar?action=getcompany&type=8-K&dateb=&owner=include&count=40&output=atom",
    "type": "atom",
    "cadence": "0 * * * *",
    "vertical": "fintech"
  },
  {
    "id": "sec-edgar-13f",
    "name": "SEC EDGAR — 13F institutional holdings (latest)",
    "url": "https://www.sec.gov/cgi-bin/browse-edgar?action=getcompany&type=13F&dateb=&owner=include&count=40&output=atom",
    "type": "atom",
    "cadence": "0 */6 * * *",
    "vertical": "fintech"
  },
  {
    "id": "sec-edgar-s1",
    "name": "SEC EDGAR — S-1 registration statements (latest)",
    "url": "https://www.sec.gov/cgi-bin/browse-edgar?action=getcompany&type=S-1&dateb=&owner=include&count=40&output=atom",
    "type": "atom",
    "cadence": "0 */6 * * *",
    "vertical": "fintech"
  },
  {
    "id": "sec-press-releases",
    "name": "SEC — press releases",
    "url": "https://www.sec.gov/news/pressreleases.rss",
    "type": "rss",
    "cadence": "0 */6 * * *",
    "vertical": "fintech"
  },
  {
    "id": "sec-litigation-releases",
    "name": "SEC — litigation releases",
    "url": "https://www.sec.gov/rss/litigation/litreleases.xml",
    "type": "rss",
    "cadence": "0 */12 * * *",
    "vertical": "fintech"
  },
  {
    "id": "sec-investor-alerts",
    "name": "SEC — investor alerts and bulletins",
    "url": "https://www.sec.gov/rss/investor/alerts.xml",
    "type": "rss",
    "cadence": "0 */12 * * *",
    "vertical": "fintech"
  },
  {
    "id": "sec-final-rules",
    "name": "SEC — final rules",
    "url": "https://www.sec.gov/rss/rules/final.xml",
    "type": "rss",
    "cadence": "0 8 * * *",
    "vertical": "fintech"
  },
  {
    "id": "sec-proposed-rules",
    "name": "SEC — proposed rules",
    "url": "https://www.sec.gov/rss/rules/proposed.xml",
    "type": "rss",
    "cadence": "0 8 * * *",
    "vertical": "fintech"
  },
  {
    "id": "sec-administrative-proceedings",
    "name": "SEC — administrative proceedings",
    "url": "https://www.sec.gov/rss/litigation/admin.xml",
    "type": "rss",
    "cadence": "0 */12 * * *",
    "vertical": "fintech"
  },
  {
    "id": "treasury-press-releases",
    "name": "US Treasury — press releases",
    "url": "https://home.treasury.gov/news/press-releases/feed",
    "type": "rss",
    "cadence": "0 */6 * * *",
    "vertical": "fintech"
  },
  {
    "id": "treasury-ofac-recent-actions",
    "name": "US Treasury OFAC — recent sanctions actions",
    "url": "https://ofac.treasury.gov/recent-actions",
    "type": "http",
    "cadence": "0 */6 * * *",
    "vertical": "fintech"
  },
  {
    "id": "fincen-news-releases",
    "name": "FinCEN — news releases",
    "url": "https://www.fincen.gov/news-room/news-releases",
    "type": "http",
    "cadence": "0 */12 * * *",
    "vertical": "fintech"
  },
  {
    "id": "federal-register-banking",
    "name": "Federal Register — banking and banking topic",
    "url": "https://www.federalregister.gov/api/v1/documents.rss?conditions%5Btopics%5D%5B%5D=banking-and-banking",
    "type": "rss",
    "cadence": "0 */6 * * *",
    "vertical": "fintech"
  },
  {
    "id": "federal-register-securities",
    "name": "Federal Register — securities topic",
    "url": "https://www.federalregister.gov/api/v1/documents.rss?conditions%5Btopics%5D%5B%5D=securities",
    "type": "rss",
    "cadence": "0 */6 * * *",
    "vertical": "fintech"
  },
  {
    "id": "federal-register-credit",
    "name": "Federal Register — credit topic",
    "url": "https://www.federalregister.gov/api/v1/documents.rss?conditions%5Btopics%5D%5B%5D=credit",
    "type": "rss",
    "cadence": "0 */12 * * *",
    "vertical": "fintech"
  },
  {
    "id": "federal-register-currency",
    "name": "Federal Register — currency topic",